<?xml version="1.0" encoding="UTF-8"?>
<map xmlns="http://www.w3schools.com/map.xsd"
     xmlns:xsi="http://www.w3.org/2001/XMLSchema-instance"
     xsi:schemaLocation="http://www.w3schools.com/map.xsd ../lib/map.xsd">
     <node>
		<point>
			<x>0</x>
			<y>0</y>
			<z>0</z>
		</point>
		<dungeon>
			<name>Tomb</name>
			<description>A small room with many coffins</description>
			<entity>
				<type>Hero</type>
				<nametag>Keops</nametag>
			</entity>
			<entity>
				<type>Mob</type>
				<nametag>Mummy</nametag>
			</entity>
		</dungeon>

		<adjacent>
			<point>
				<x>1</x>
				<y>0</y>
				<z>0</z>
			</point>
		</adjacent>
	</node>
	<node>
		<point>
			<x>2</x>
			<y>0</y>
			<z>1</z>
		</point>
		<dungeon>
			<name>Secret Room</name>
			<description>Only The One could reach this room</description>
		</dungeon>
		<adjacent>
			<point>
				<x>1</x>
				<y>0</y>
				<z>0</z>
			</point>
		</adjacent>
	</node>
</map>